{
  "schema_version": "1.0",
  "config_name": "fl800_green_config",
  "camera": {
    "pixel_size_um": 4.0,
    "image_width": 1290,
    "image_height": 826
  },
  "optical": {
    "distance_m": 0.03,
    "hartmann_spacing_mm": null
  },
  "image_processing": {
    "roi_width_ratio": 0.9,
    "roi_height_ratio": 0.9,
    "median_kernel": 3,
    "tophat_kernel": 30,
    "otsu_a": 0.4,
    "otsu_b": 0.7,
    "max_depth": 2
  },
  "recognition": {
    "spot_count_mode": "auto",
    "expected_spot_count": null,
    "min_confidence": 0.7
  },
  "calculation": {
    "pixel_threshold": 1.0,
    "angle_unit": "degree",
    "diopter_unit": "D"
  },
  "path_policy": {
    "path_type": "relative_to_project_root",
    "allow_absolute_path": false
  },
  "illumination": {
    "source_color": "green",
    "wavelength_nm": null
  },
  "hartmann_calibration": {
    "spacing_source": "camera_pixel_spacing",
    "spot_spacing_px": null,
    "spacing_formula": "spot_spacing_px * camera.pixel_size_um / 1000"
  },
  "measurement_targets": {
    "sphere_min_d": -25.0,
    "sphere_max_d": 25.0,
    "sphere_steps_d": [0.01, 0.06, 0.12, 0.25],
    "cylinder_min_d": -10.0,
    "cylinder_max_d": 10.0,
    "cylinder_steps_d": [0.01, 0.06, 0.12, 0.25],
    "prism_min_delta": 0.0,
    "prism_max_delta": 15.0,
    "prism_step_delta": 0.01,
    "axis_min_degree": 0,
    "axis_max_degree": 180,
    "axis_step_degree": 1,
    "addition_min_d": 0.0,
    "addition_max_d": 10.0,
    "addition_steps_d": [0.01, 0.06, 0.12, 0.25],
    "uv_min_percent": 1,
    "uv_max_percent": 100,
    "uv_steps_percent": [1, 15]
  },
  "data_profile": {
    "data_source": "synthetic",
    "validation_status": "simulation_only",
    "hardware_parameters_confirmed": false
  },
  "calibration_reference": {
    "calibration_file": "data/calibration/simulation_calibration.json",
    "calibration_version": "simulation-v1",
    "parameter_status": "simulated"
  }
}
